{
  "schema_version": 1,
  "id": "week-1",
  "title": "Spend a P2WPKH output",
  "category": "transactions",
  "difficulty": "easy",
  "languages": [
    "rust",
    "py",
    "cpp"
  ],
  "fixture": "funded-p2wpkh",
  "limits": {
    "wall_sec": 30,
    "memory_mb": 512
  },
  "services": {
    "bitcoind": true,
    "lnd": false,
    "electrs": false
  }
}
